{ "compressionlevel":-1,
 "height":3,
 "infinite":false,
 "layers":[
        {
         "compression":"",
         "data":"GQAAABoAAAAbAAAAIwAAACQAAAAlAAAALQAAAC4AAAAvAAAA",
         "encoding":"base64",
         "height":3,
         "id":1,
         "name":"Walls_Exterior",
         "opacity":1,
         "type":"tilelayer",
         "visible":true,
         "width":3,
         "x":0,
         "y":0
        }],
 "nextlayerid":2,
 "nextobjectid":1,
 "orientation":"orthogonal",
 "renderorder":"right-down",
 "tiledversion":"1.11.2",
 "tileheight":32,
 "tilesets":[
        {
         "firstgid":1,
         "source":"..\/lawchuck\/badgey.org\/kimbar\/public\/content\/tiled\/tilesets\/megabob.tsx"
        }],
 "tilewidth":32,
 "type":"map",
 "version":1.1,
 "width":3
}